Link,Price,Discount,Brand,Shipping
White Wooden Framed Art Print,"₹ 1,499",,by Indigifts,Ships In 3 Days
Red Acrylic Canvas River In Venice Unframed Original Painting,"₹ 12,699",(17% Off),by Pisarto,Ships In 5 Days
Blue MDF & Wooden Framed Art Print,"₹ 1,709",,by Vinoxo,Ships In 3 Days
Blue Wooden Framed Printed Landscape Abstract Canvas Art Print,"₹ 2,199",(16% Off),by 999Store,Ships In 8 Days
Multicolour Silk Lotus Wall Mural,"₹ 8,099",(10% Off),by Earthen Symphony,Ships In 3 Days
Textured Paper Wood Framed Art Print In Blue,₹ 799,(67% Off),by Chaque Decor,Ships In 2 Days
Orange Cotton Canvas Forces Of Nature Art Print,"₹ 3,807",(20% Off),by Mera wala print,Ships In 3 Days
Textured Paper Wood Framed Art Print In Green,₹ 779,(75% Off),by Chaque Decor,Ships In 2 Days
Orange Acrylic Canvas Fishing Village At Sunset Unframed Original Painting,"₹ 11,601",(5% Off),by Pisarto,Ships In 5 Days
Blue Acrylic Canvas Dancing Horses Unframed Original Painting,"₹ 11,665",(13% Off),by Pisarto,Ships In 5 Days
Krishna MDF Set of 3 Wall Art Print,₹ 599,(63% Off),by WENS,Ships In 3 Days
Textured Paper Wood Framed Art Print In White,₹ 849,(67% Off),by Chaque Decor,Ships In 2 Days
"White ""Indian Traditional People Art""Textured Paper  Scratch/Dust Proof Framed Art Print",₹ 806,(61% Off),by Gallery99,Ships In 2 Days
Cotton Canvas 72 x 0.4 x 48 Inch Horses on a Sand Painting Unframed Digital Art Print,"₹ 3,949",(69% Off),by 999Store,Ships In 15 Days
Yellow Wood Dhokra & Warli Textured Paper Scratch/Dust Proof Painting,"₹ 2,025",(50% Off),by Chaque Decor,Ships In 3 Days
Figurative MDF Set of 3 Wall Art Print,₹ 599,(66% Off),by WENS,Ships In 3 Days
Blue Cotton Canvas Summer River In The Forest Art Print,"₹ 3,499",(5% Off),by Mera wala print,Ships In 3 Days
Foggy City Cotton Canvas Framed Art Print,"₹ 2,279",(24% Off),by @home,Ships In 6 Days
Village Market Canvas Landscape Acrylic Painting,"₹ 14,249",(6% Off),by Pisarto,Ships In 5 Days
Abstract Unframed Yellow Charcoal Premium Canvas Print 59 x 44 Inches,"₹ 4,236",(17% Off),by Mera wala print,Ships In 3 Days
"Green ""A Romantic Oil Art Print"" Textured Paper  Scratch/Dust Proof Framed Art Print",₹ 806,(61% Off),by Gallery99,Ships In 2 Days
Paper 17 x 0.5 x 12 Inch Buddha Meditation Framed Digital Poster,"₹ 1,149",(28% Off),by Tallenge,Ships In 6 Days
White Framed Canvas Painting (33 x 21 Inches),"₹ 3,239",(18% Off),by Inephos,Ships In 1 Day
Pink Framed Canvas Painting (33 x 21 Inches),"₹ 3,239",(18% Off),by Inephos,Ships In 1 Day
Yellow Brass Warli Brass Figurine Doubleboarding Wall Art,"₹ 1,499",(5% Off),by Chaque Decor,Ships In 3 Days
Brown Cotton Canvas Abstract Digital Premium Art Print,"₹ 3,099",(61% Off),by Mera wala print,Ships In 3 Days
Original Handmade Canvas Portrait Oil Painting,"₹ 6,345",(10% Off),by Gallery99,Ships In 2 Days
Textured Paper Wood Framed Art Print In Red,₹ 819,(69% Off),by Chaque Decor,Ships In 2 Days
Gold Metal Leaves Wall Art,"₹ 4,652",(48% Off),by Malik Design,Ships In 3 Days
Canvas Without Frame Art Prints In Brown,"₹ 3,257",(71% Off),by Mera wala print,Ships In 2 Days
Canvas Without Frame Art Prints In Golden,"₹ 3,167",(52% Off),by Mera wala print,Ships In 2 Days
Pink Framed Canvas Painting (33 x 21 Inches),"₹ 3,239",(18% Off),by Inephos,Ships In 1 Day
White Acrylic Canvas Bond Of Friendship Unframed Original Painting,"₹ 14,458",(7% Off),by Pisarto,Ships In 5 Days
"White ""Abstract Original Oil Art Print"" Textured Paper  Scratch/Dust Proof Framed Art Print",₹ 806,(61% Off),by Gallery99,Ships In 2 Days
Modern City Abstract  Cotton Canvas 35 x 24 Inch Wooden Framed Digital Art Print,"₹ 1,899",(17% Off),by 999Store,Ships In 9 Days
Relaxing Ganesha Canvas Landscape Acrylic Painting,"₹ 14,049",(6% Off),by Pisarto,Ships In 5 Days
Sunrise View MDF Set of 3 Wall Art Print,₹ 599,(63% Off),by WENS,Ships In 3 Days
Red Framed Canvas Painting (33 x 21 Inches),"₹ 3,239",(18% Off),by Inephos,Ships In 1 Day
Ship On Shore Plastic Framed Art Print,₹ 399,(10% Off),by @home,Ships In 6 Days
Red Cotton Canvas The Perspective Of A Seaside Art Print,"₹ 2,318",(5% Off),by Mera wala print,Ships In 3 Days
Yellow Cotton Canvas Abstract Digital Premium Art Print,"₹ 3,149",(61% Off),by Mera wala print,Ships In 3 Days
Textured Paper Wood Framed Art Print In Brown,₹ 589,(67% Off),by Chaque Decor,Ships In 2 Days
Canvas 40 x 0.5 x 28 Inch Radha Krishna Hand Framed Oil Paintings,"₹ 6,749",(23% Off),by Gallery99,Ships In 5 Days
Golden Wooden Framed Printed The face of Buddha Canvas Art Print,"₹ 2,199",(75% Off),by 999Store,Ships In 8 Days
Black Cotton Canvas Street Of London Art Print,"₹ 3,071",(5% Off),by Mera wala print,Ships In 3 Days
Cotton Canvas 36 x 0.4 x 72 Inch Abstract Painting Unframed Digital Art Print,"₹ 2,899",(50% Off),by 999Store,Ships In 15 Days
Green Wooden Framed Printed Autumn Heart Leafs on Canvas Art Print,"₹ 1,699",(5% Off),by 999Store,Ships In 8 Days
Multicolour Cotton Canvas Unframed Goddess Lakshmi,"₹ 2,899",(28% Off),by Inspicanvas,Ships In 5 Days
Blue Printed Beautiful Flowering Japanese Cherry Sakura Wooden Stretched Canvas Art Print,"₹ 2,099",(28% Off),by 999Store,Ships In 8 Days
"Black ""Human Face Abstract Original Oil Art Print"" Textured Paper  Scratch/Dust Proof Framed Art Print",₹ 806,(61% Off),by Gallery99,Ships In 2 Days
